{
  "authorization_id": "ADT-ANTI-OBJECTIVE-PROMPT-R2",
  "authority_source": "Human Holder authorization for Anti-Objective Prompt system",
  "human_role": "HUMAN_HOLDER",
  "repository": "butbutbutbutbutbut/adaptive-digital-team",
  "base_sha": "506bbfb2ad5e44a7c29766be9be29afa6a7fe514",
  "branch": "hermes/adt-anti-objective-prompt-r2",
  "authorized_actions": [
    "read",
    "write_file",
    "commit",
    "push",
    "create_draft_pr"
  ],
  "authorized_write_scope": [
    "protocols/ADT_ANTI_OBJECTIVE_PROMPT.md",
    "AGENTS.md",
    ".hermes/CANDIDATE_BINDING.json"
  ],
  "risk_boundary": "LOW",
  "task_id": "ADT-ANTI-OBJECTIVE-PROMPT-R2",
  "human_holder_approved": true
}
